{
  "_id": "69429/c0q814m91v8f",
  "ocrType": "txtmap",
  "source": {
    "from": "cihm",
    "path": "ooe.sas_19720816EP/data/sip/data/files/ooe.19720816EP0002.tif"
  },
  "master": {
    "path": "ooe.sas_19720816EP/data/sip/data/files/ooe.19720816EP0002.tif",
    "mime": "image/tiff",
    "size": 48001,
    "width": 2583,
    "height": 3350
  }
}
